,library,jsonFileName,signature,name,targetClass,equivalence.comment,equivalence.kind,equivalence.condition
0,hibernate,org.hibernate.engine.spi.SubselectFetch_goal.json,"org.hibernate.engine.spi.SubselectFetch(java.lang.String subselectFetchQueryFragment, java.lang.String alias, org.hibernate.persister.entity.Loadable loadable, org.hibernate.engine.spi.QueryParameters queryParameters, java.util.Set resultingEntityKeys, java.util.Map namedParameterLocMap)",org.hibernate.engine.spi.SubselectFetch,org.hibernate.engine.spi.SubselectFetch,"Construct a SubselectFetch instance using the provided subselect fetch query fragment, subselectFetchQueryFragment. It is assumed that subselectFetchQueryFragment is the result of calling #createSubselectFetchQueryFragment with the same value provided for queryParameters.",FreeText,methodResultID.equals(org.hibernate.engine.spi.SubselectFetch.createSubselectFetchQueryFragment(args[3]))
1,hibernate,org.hibernate.internal.util.collections.BoundedConcurrentHashMap_goal.json,contains(java.lang.Object value),contains,org.hibernate.internal.util.collections.BoundedConcurrentHashMap,"Legacy method testing if some key maps into the specified value in this table. This method is identical in functionality to #containsValue, and exists solely to ensure full compatibility with class java.util.Hashtable, which supported this method prior to introduction of the Java Collections framework.",FreeText,methodResultID==(receiverObjectClone.containsValue(args[0]))
2,hibernate,org.hibernate.internal.util.collections.ConcurrentReferenceHashMap_goal.json,contains(java.lang.Object value),contains,org.hibernate.internal.util.collections.ConcurrentReferenceHashMap,"Legacy method testing if some key maps into the specified value in this table. This method is identical in functionality to #containsValue, and exists solely to ensure full compatibility with class java.util.Hashtable, which supported this method prior to introduction of the Java Collections framework.",FreeText,methodResultID==(receiverObjectClone.containsValue(args[0]))
3,hibernate,org.hibernate.internal.util.xml.BufferedXMLEventReader_goal.json,mark(),mark,org.hibernate.internal.util.xml.BufferedXMLEventReader,Same as calling #mark(int) with -1.,FreeText,receiverObjectClone.mark(-1); receiverObjectID.equals(receiverObjectClone)
4,hibernate,org.hibernate.loader.plan.spi.BidirectionalEntityReference_goal.json,getQuerySpaceUid(),getQuerySpaceUid,org.hibernate.loader.plan.spi.BidirectionalEntityReference,The query space UID returned using #getQuerySpaceUid() must be the same as returned by #getTargetEntityReference()#getQuerySpaceUid(),FreeText,methodResultID.equals(receiverObjectClone.getTargetEntityReference())
